<?xml version="1.0" encoding="ISO-8859-1"?>
<!DOCTYPE database [
	<!ELEMENT database	(namegroups, continents)>
	<!ELEMENT namegroups	(group*)>
	<!ELEMENT group		(name*|lastname*)>
	<!ELEMENT name		(#PCDATA)>
	<!ELEMENT lastname	(#PCDATA)>
	<!ELEMENT continents	(continent*)>
	<!ELEMENT continent	(country*)>
	<!ELEMENT country	(probability*)>
	<!ELEMENT probability	(#PCDATA)>

	<!ATTLIST database type (names) #REQUIRED>
	<!ATTLIST group origin CDATA #REQUIRED sex (male|female|either) "either"> 
	<!ATTLIST continent name CDATA #REQUIRED>
	<!ATTLIST country name CDATA #REQUIRED>
	<!ATTLIST probability group CDATA #REQUIRED>
]>
<database type="names">
  <namegroups>
    <group origin="Afrikaans" sex="male">
      <name>Aaliyah</name>
      <name>Ababajoni</name>
      <name>Abakada</name>
      <name>Abanobi</name>
      <name>Abaronye</name>
      <name>Abas</name>
      <name>Abasi</name>
      <name>Abayghur</name>
      <name>Abayomi</name>
      <name>Abazu</name>
      <name>Abazza</name>
      <name>Abbakha</name>
      <name>Abbas</name>
      <name>Antron</name>
      <name>Anwar</name>
      <name>Anyanwu</name>
      <name>Aputat</name>
      <name>Araba</name>
      <name>Arabi</name>
      <name>Araya</name>
      <name>Aziz</name>
      <name>Chidubem</name>
      <name>Chiedozie</name>
      <name>Chielo</name>
      <name>Chieloka</name>
      <name>Chiemela</name>
      <name>Chiemezie</name>
      <name>Chiganu</name>
      <name>Chigozie</name>
      <name>Fabeni</name>
      <name>Falah</name>
      <name>Faraji</name>
      <name>Farid</name>
      <name>Farida</name>
      <name>Farri</name>
      <name>Fassil</name>
      <name>Jalen</name>
      <name>Jalloun</name>
      <name>Jamal</name>
      <name>Jamba</name>
      <name>Jameelah</name>
      <name>Jameria</name>
      <name>Jamilah</name>
      <name>Jamille</name>
      <name>Karim</name>
      <name>Kumsa</name>
      <name>Kunto</name>
      <name>Kuron</name>
      <name>Kusuru</name>
      <name>Kutre</name>
      <name>Kwabina</name>
      <name>Kwadwo</name>
      <name>Mehdi</name>
      <name>Modise</name>
      <name>Modupe</name>
      <name>Moeti</name>
      <name>Mogotsi</name>
      <name>Mohamed</name>
      <name>Mohammed</name>
      <name>Moktar</name>
      <name>Molefe</name>
      <name>Mollenox</name>
      <name>Moloi</name>
      <name>Obiora</name>
      <name>Obrano</name>
      <name>Obukohwo</name>
      <name>Ochen</name>
      <name>Ochieng</name>
      <name>Odai</name>
      <name>Odalai</name>
      <name>Odarte</name>
      <name>Odatei</name>
      <name>Rubbenz</name>
      <name>Rudo</name>
      <name>Rufaro</name>
      <name>Ruhakena</name>
      <name>Ruhinda</name>
      <name>Rumisha</name>
      <name>Russom</name>
      <name>Ruusa</name>
      <name>Saadiq</name>
      <name>Sabacus</name>
      <name>Sabah</name>
      <name>Thiongo</name>
      <name>Thoko</name>
      <name>Thulani</name>
      <name>Tidiane</name>
      <name>Tilahun</name>
      <name>Tiljad</name>
      <name>Timmi</name>
      <name>Tisa</name>
      <name>Youssef</name>
      <name>Zuka</name>
      <name>Zuri</name>
    </group>
    <group origin="Afrikaans" sex="female">
      <name>Aaliyah</name>
      <name>Ababuo</name>
      <name>Abagebe</name>
      <name>Abana</name>
      <name>Abayomi</name>
      <name>Abbeba</name>
      <name>Asura</name>
      <name>Atakuma</name>
      <name>Atese</name>
      <name>Atsufi</name>
      <name>Chuike</name>
      <name>Chuki</name>
      <name>Chukwuma</name>
      <name>Cinese</name>
      <name>Ghida</name>
      <name>Gimbya</name>
      <name>Ginika</name>
      <name>Gozie</name>
      <name>Kareem</name>
      <name>Kariamu</name>
      <name>Karimah</name>
      <name>Karimu</name>
      <name>Kasadia</name>
      <name>Kaseko</name>
      <name>Kashay</name>
      <name>Kashta</name>
      <name>Kasia</name>
      <name>Kasinda</name>
      <name>Khawla</name>
      <name>Mahari</name>
      <name>Mahasin</name>
      <name>Mahdi</name>
      <name>Maiba</name>
      <name>Maizah</name>
      <name>Mariam</name>
      <name>Nichelle</name>
      <name>Nickisha</name>
      <name>Nika</name>
      <name>Nikilya</name>
      <name>Niqualette</name>
      <name>Nirina</name>
      <name>Rabodo</name>
      <name>Rachida</name>
      <name>Radhiya</name>
      <name>Shayma</name>
      <name>Sybrell</name>
      <name>Sylvannah</name>
      <name>Tabya</name>
      <name>Tafat</name>
      <name>Yari</name>
      <name>Yatima</name>
      <name>Yemi</name>
    </group>
    <group origin="American" sex="male">
      <name>Adam</name>
      <name>Alan</name>
      <name>Arnold</name>
      <name>Brad</name>
      <name>Brian</name>
      <name>Dallas</name>
      <name>David</name>
      <name>Charles</name>
      <name>Chris</name>
      <name>Chuck</name>
      <name>Connor</name>
      <name>Daniel</name>
      <name>Davy</name>
      <name>Dwight</name>
      <name>Ed</name>
      <name>Frank</name>
      <name>Gary</name>
      <name>George</name>
      <name>Homer</name>
      <name>Jack</name>
      <name>James</name>
      <name>Jason</name>
      <name>Jeff</name>
      <name>Joe</name>
      <name>John</name>
      <name>Ken</name>
      <name>Kurt</name>
      <name>Luke</name>
      <name>Mark</name>
      <name>Michael</name>
      <name>Paul</name>
      <name>Randy</name>
      <name>Richard</name>
      <name>Robert</name>
      <name>Robin</name>
      <name>Ronald</name>
      <name>Ross</name>
      <name>Scott</name>
      <name>Steve</name>
      <name>Tom</name>
      <name>Tony</name>
      <name>Virgil</name>
      <name>William</name>
      <name>Zane</name>
      <lastname>Allen</lastname>
      <lastname>Anderson</lastname>
      <lastname>Brown</lastname>
      <lastname>Carter</lastname>
      <lastname>Collins</lastname>
      <lastname>Davis</lastname>
      <lastname>Dreyfus</lastname>
      <lastname>Gallagher</lastname>
      <lastname>Garcia</lastname>
      <lastname>Hall</lastname>
      <lastname>Harris</lastname>
      <lastname>Hudson</lastname>
      <lastname>Jackson</lastname>
      <lastname>Johnson</lastname>
      <lastname>Lee</lastname>
      <lastname>Lewis</lastname>
      <lastname>Lopez</lastname>
      <lastname>Lincoln</lastname>
      <lastname>McDonald</lastname>
      <lastname>McNeil</lastname>
      <lastname>Miller</lastname>
      <lastname>O'Neil</lastname>
      <lastname>Taylor</lastname>
      <lastname>Thompson</lastname>
      <lastname>Walker</lastname>
      <lastname>Williams</lastname>
      <lastname>Young</lastname>
    </group>
    <group origin="American" sex="female">
      <name>Astrid</name>
      <name>Barbara</name>
      <name>Buffy</name>
      <name>Betty</name>
      <name>Billie-Jo</name>
      <name>Carol</name>
      <name>Clare</name>
      <name>Deborah</name>
      <name>Donna</name>
      <name>Dorothy</name>
      <name>Elizabeth</name>
      <name>Helen</name>
      <name>Hilary</name>
      <name>Jamie</name>
      <name>Janet</name>
      <name>Jennifer</name>
      <name>Jessica</name>
      <name>Karen</name>
      <name>Kim</name>
      <name>Laura</name>
      <name>Lexa</name>
      <name>Lisa</name>
      <name>Linda</name>
      <name>Margaret</name>
      <name>Maria</name>
      <name>Mary-Jane</name>
      <name>Monica</name>
      <name>Morgan</name>
      <name>Nancy</name>
      <name>Paige</name>
      <name>Patricia</name>
      <name>Piper</name>
      <name>Sandra</name>
      <name>Sharon</name>
      <name>Sigourney</name>
      <name>Susan</name>
      <name>Tasha</name>
      <lastname>Archer</lastname>
      <lastname>Evans</lastname>
      <lastname>Garcia</lastname>
      <lastname>Hernandez</lastname>
      <lastname>Hudson</lastname>
      <lastname>Johnson</lastname>
      <lastname>Jones</lastname>
      <lastname>King</lastname>
      <lastname>Martin</lastname>
      <lastname>McNeil</lastname>
      <lastname>Moore</lastname>
      <lastname>Nelson</lastname>
      <lastname>Roberts</lastname>
      <lastname>Robinson</lastname>
      <lastname>Sinatra</lastname>
      <lastname>Smith</lastname>
      <lastname>Thomas</lastname>
      <lastname>Turner</lastname>
      <lastname>Weaver</lastname>
      <lastname>White</lastname>
      <lastname>Williams</lastname>
      <lastname>Wilson</lastname>
    </group>
    <group origin="Arabic" sex="male">
      <name>Abdul</name>
      <name>Abu</name>
      <name>Abdullah</name>
      <name>Adan</name>
      <name>Alhasan</name>
      <name>Ali</name>
      <name>Ashraf</name>
      <name>Ayman</name>
      <name>Bahir</name>
      <name>Basil</name>
      <name>Budail</name>
      <name>Dabir</name>
      <name>Dali</name>
      <name>Dirar</name>
      <name>Ebi</name>
      <name>Ebrahim</name>
      <name>Fadil</name>
      <name>Fahim</name>
      <name>Falah</name>
      <name>Farid</name>
      <name>Faruq</name>
      <name>Gamal</name>
      <name>Ghalib</name>
      <name>Ghiyath</name>
      <name>Hadadd</name>
      <name>Hakim</name>
      <name>Hamzah</name>
      <name>Hassan</name>
      <name>Haytham</name>
      <name>Heydar</name>
      <name>Husain</name>
      <name>Ibrahim</name>
      <name>Ilias</name>
      <name>Irfan</name>
      <name>Ishaq</name>
      <name>Iyad</name>
      <name>Ja'far</name>
      <name>Jalal</name>
      <name>Jamal</name>
      <name>Jamil</name>
      <name>Jasim</name>
      <name>Jawhar</name>
      <name>Jibril</name>
      <name>Juwain</name>
      <name>Kadar</name>
      <name>Kaliq</name>
      <name>Kamal</name>
      <name>Kamil</name>
      <name>Karim</name>
      <name>Kazim</name>
      <name>Khalid</name>
      <name>Khalil</name>
      <name>Khareef</name>
      <name>Khasib</name>
      <name>Latif</name>
      <name>Lubaid</name>
      <name>Ma'mun</name>
      <name>Madani</name>
      <name>Mahir</name>
      <name>Malik</name>
      <name>Marid</name>
      <name>Marzuq</name>
      <name>Mashhur</name>
      <name>Maymun</name>
      <name>Mazhar</name>
      <name>Mohammed</name>
      <name>Mubarak</name>
      <name>Mujahid</name>
      <name>Mukhtar</name>
      <name>Munsif</name>
      <name>Murtada</name>
      <name>Mustafa</name>
      <name>Mutia</name>
      <name>Muyassar</name>
      <name>Na'im</name>
      <name>Nadeem</name>
      <name>Nadir</name>
      <name>Najjar</name>
      <name>Nasha'h</name>
      <name>Nasir</name>
      <name>Nijad</name>
      <name>Qasim</name>
      <name>Qusay</name>
      <name>Rabah</name>
      <name>Rashid</name>
      <name>Rushdi</name>
      <name>Sa'eed</name>
      <name>Sabir</name>
      <name>Sadiq</name>
      <name>Safwan</name>
      <name>Saif</name>
      <name>Saleh</name>
      <name>Salman</name>
      <name>Samih</name>
      <name>Samman</name>
      <name>Shamal</name>
      <name>Sharif</name>
      <name>Siddiq</name>
      <name>Sulaiman</name>
      <name>Tahir</name>
      <name>Tamim</name>
      <name>Tariq</name>
      <name>Taysir</name>
      <name>Ubaidah</name>
      <name>Uday</name>
      <name>Usama</name>
      <name>Walif</name>
      <name>Wazir</name>
      <name>Yasar</name>
      <name>Youssef</name>
      <name>Zafar</name>
      <name>Zain</name>
      <name>Zaki</name>
      <name>Zubair</name>
      <lastname>Ababneh</lastname>
      <lastname>Abbas</lastname>
      <lastname>Abdel</lastname>
      <lastname>Abdullah</lastname>
      <lastname>Abolhassan</lastname>
      <lastname>Alam</lastname>
      <lastname>Ameen</lastname>
      <lastname>Amin</lastname>
      <lastname>Armanjani</lastname>
      <lastname>Awad</lastname>
      <lastname>Ayasha</lastname>
      <lastname>Bari</lastname>
      <lastname>Essa</lastname>
      <lastname>Habib</lastname>
      <lastname>Haddad</lastname>
      <lastname>Hamid</lastname>
      <lastname>Hasan</lastname>
      <lastname>Hassan</lastname>
      <lastname>Hussain</lastname>
      <lastname>Ibraheem</lastname>
      <lastname>Ismail</lastname>
      <lastname>Issa</lastname>
      <lastname>Jabir</lastname>
      <lastname>Kaleel</lastname>
      <lastname>Kalil</lastname>
      <lastname>Khaleel</lastname>
      <lastname>Khaleel</lastname>
      <lastname>Khatib</lastname>
      <lastname>Khoury</lastname>
      <lastname>Mahmoud</lastname>
      <lastname>Mansour</lastname>
      <lastname>Mazin</lastname>
      <lastname>Mousa</lastname>
      <lastname>Mustafa</lastname>
      <lastname>Najeeb</lastname>
      <lastname>Najjar</lastname>
      <lastname>Nasser</lastname>
      <lastname>Omar</lastname>
      <lastname>Ommar</lastname>
      <lastname>Qasim</lastname>
      <lastname>Qassem</lastname>
      <lastname>Rahman</lastname>
      <lastname>Rasheed</lastname>
      <lastname>Saad</lastname>
      <lastname>Salah</lastname>
      <lastname>Saleem</lastname>
      <lastname>Saleh</lastname>
      <lastname>Salim</lastname>
      <lastname>Shaheen</lastname>
      <lastname>Shahriar</lastname>
      <lastname>Shareef</lastname>
      <lastname>Sharif</lastname>
      <lastname>Sleiman</lastname>
      <lastname>Sulaiman</lastname>
      <lastname>Temiz</lastname>
      <lastname>Yaseen</lastname>
    </group>
    <group origin="Arabic" sex="female">
      <name>Adara</name>
      <name>Afrah</name>
      <name>Ahlam</name>
      <name>Aida</name>
      <name>Aisha</name>
      <name>Akilah</name>
      <name>Alima</name>
      <name>Aludra</name>
      <name>Aminah</name>
      <name>Amurra</name>
      <name>Aqilah</name>
      <name>Asima</name>
      <name>Atifa</name>
      <name>Azale</name>
      <name>Badriyah</name>
      <name>Bahira</name>
      <name>Basmah</name>
      <name>Cala</name>
      <name>Dalia</name>
      <name>Emira</name>
      <name>Ermina</name>
      <name>Fadilah</name>
      <name>Fakihah</name>
      <name>Fatima</name>
      <name>Ghaliyah</name>
      <name>Gulshan</name>
      <name>Hadiya</name>
      <name>Hanifah</name>
      <name>Hazar</name>
      <name>Hessa</name>
      <name>Inayah</name>
      <name>Izzah</name>
      <name>Jaan</name>
      <name>Jabira</name>
      <name>Johara</name>
      <name>Juhanah</name>
      <name>Juwan</name>
      <name>Kabirah</name>
      <name>Kalila</name>
      <name>Karida</name>
      <name>Khalisah</name>
      <name>Latifah</name>
      <name>Leena</name>
      <name>Leila</name>
      <name>Lutfiyah</name>
      <name>Madinah</name>
      <name>Mahfouza</name>
      <name>Mahalah</name>
      <name>Miriam</name>
      <name>Mona</name>
      <name>Nadia</name>
      <name>Nasheeta</name>
      <name>Qismah</name>
      <name>Rabeea</name>
      <name>Rihana</name>
      <name>Rebecca</name>
      <name>Rumailah</name>
      <name>Sabirah</name>
      <name>Safa</name>
      <name>Saffanah</name>
      <name>Safiya</name>
      <name>Salima</name>
      <name>Sarah</name>
      <name>Shadiyah</name>
      <name>Suhair</name>
      <name>Tabalah</name>
      <name>Thara</name>
      <name>Wisal</name>
      <name>Yaram</name>
      <name>Yasamin</name>
      <name>Zafirah</name>
      <name>Zuhrah</name>
      <lastname>Ababneh</lastname>
      <lastname>Abbas</lastname>
      <lastname>Abdel</lastname>
      <lastname>Abdellah</lastname>
      <lastname>Abdul</lastname>
      <lastname>Abdulah</lastname>
      <lastname>Abdullah</lastname>
      <lastname>Abolhassan</lastname>
      <lastname>Ahmad</lastname>
      <lastname>Ahmed</lastname>
      <lastname>Alam</lastname>
      <lastname>Ali</lastname>
      <lastname>Ameen</lastname>
      <lastname>Amin</lastname>
      <lastname>Armanjani</lastname>
      <lastname>Awad</lastname>
      <lastname>Ayasha</lastname>
      <lastname>Aziz</lastname>
      <lastname>Bari</lastname>
      <lastname>Essa</lastname>
      <lastname>Habib</lastname>
      <lastname>Haddad</lastname>
      <lastname>Hamdan</lastname>
      <lastname>Hamid</lastname>
      <lastname>Hana</lastname>
      <lastname>Hanna</lastname>
      <lastname>Hasan</lastname>
      <lastname>Hassan</lastname>
      <lastname>Hossein</lastname>
      <lastname>Hussain</lastname>
      <lastname>Ibraheem</lastname>
      <lastname>Ibrahim</lastname>
      <lastname>Ismail</lastname>
      <lastname>Jaber</lastname>
      <lastname>Jabir</lastname>
      <lastname>Kaleel</lastname>
      <lastname>Kalil</lastname>
      <lastname>Karim</lastname>
      <lastname>Khaleel</lastname>
      <lastname>Khalil</lastname>
      <lastname>Khatib</lastname>
      <lastname>Khoury</lastname>
      <lastname>Mahmad</lastname>
      <lastname>Mahmoud</lastname>
      <lastname>Mailik</lastname>
      <lastname>Mansoor</lastname>
      <lastname>Mazin</lastname>
      <lastname>Mohammad</lastname>
      <lastname>Mousa</lastname>
      <lastname>Murat</lastname>
      <lastname>Mustafa</lastname>
      <lastname>Najeeb</lastname>
      <lastname>Najjar</lastname>
      <lastname>Naser</lastname>
      <lastname>Nasser</lastname>
      <lastname>Omer</lastname>
      <lastname>Ommar</lastname>
      <lastname>Qasem</lastname>
      <lastname>Qasim</lastname>
      <lastname>Qassem</lastname>
      <lastname>Rahman</lastname>
      <lastname>Rasheed</lastname>
      <lastname>Rashid</lastname>
      <lastname>Saad</lastname>
      <lastname>Salah</lastname>
      <lastname>Saleem</lastname>
      <lastname>Salih</lastname>
      <lastname>Salman</lastname>
      <lastname>Shaheen</lastname>
      <lastname>Shahriar</lastname>
      <lastname>Sharif</lastname>
      <lastname>Sleiman</lastname>
      <lastname>Sulayman</lastname>
      <lastname>Temiz</lastname>
      <lastname>Turk</lastname>
      <lastname>Yaseen</lastname>
      <lastname>Yousef</lastname>
    </group>
    <group origin="Armenian" sex="male">
      <name>Abel</name>
      <name>Abgar</name>
      <name>Abik</name>
      <name>Abraham</name>
      <name>Abyan</name>
      <name>Adam</name>
      <name>Adel</name>
      <name>Adolf</name>
      <name>Adran</name>
      <name>Adrian</name>
      <name>Agatan</name>
      <name>Agaton</name>
      <name>Aghajan</name>
      <name>Aghalo</name>
      <name>Aharom</name>
      <name>Alishan</name>
      <name>Amadian</name>
      <name>Amarian</name>
      <name>Andrian</name>
      <name>Antonova</name>
      <name>Areyan</name>
      <name>Asner</name>
      <name>Astorian</name>
      <name>Bago</name>
      <name>Goharik</name>
      <name>Gomidas</name>
      <name>Goriun</name>
      <name>Gosdan</name>
      <name>Gosdantin</name>
      <name>Gostig</name>
      <name>Gregory</name>
      <name>Grigor</name>
      <name>Grigoris</name>
      <name>Nicetas</name>
      <name>Nicolaos</name>
      <name>Nika</name>
      <name>Nikoghos</name>
      <name>Nikolay</name>
      <name>Ninon</name>
      <name>Nishan</name>
      <name>Vervant</name>
      <name>Verzhine</name>
      <name>Vidok</name>
      <name>Viken</name>
      <name>Viktor</name>
      <name>Vilen</name>
      <name>Vilhelm</name>
      <name>Villik</name>
      <name>Vishab</name>
    </group>
    <group origin="Armenian" sex="female">
      <name>Ada</name>
      <name>Adelaida</name>
      <name>Adelina</name>
      <name>Adriana</name>
      <name>Adriana</name>
      <name>Adrine</name>
      <name>Aelita</name>
      <name>Agaphya</name>
      <name>Agata</name>
      <name>Aghny</name>
      <name>Alinush</name>
      <name>Ananova</name>
      <name>Kristina</name>
      <name>Kristine</name>
      <name>Krizia</name>
      <name>Lala</name>
      <name>Lamara</name>
      <name>Lana</name>
      <name>Larisa</name>
      <name>Laura</name>
      <name>Lena</name>
      <name>Lendrusha</name>
      <name>Turvanda</name>
      <name>Ursula</name>
      <name>Valentina</name>
      <name>Valeria</name>
      <name>Valya</name>
      <name>Vanya</name>
    </group>
    <group origin="Australian" sex="male">
      <name>Brett</name>
      <name>Bruce</name>
      <name>Cooper</name>
      <name>Ethan</name>
      <name>Jack</name>
      <name>Jason</name>
      <name>Joshua</name>
      <name>Lachlan</name>
      <name>Liam</name>
      <name>Luke</name>
      <name>Matthew</name>
      <name>Noah</name>
      <name>Patrick</name>
      <name>Ryan</name>
      <name>Thomas</name>
      <name>William</name>
    </group>
    <group origin="Australian" sex="female">
      <name>Charlotte</name>
      <name>Ella</name>
      <name>Emily</name>
      <name>Isabella</name>
      <name>Jessica</name>
      <name>Lily</name>
      <name>Mia</name>
      <name>Olivia</name>
      <name>Shiela</name>
      <name>Sienna</name>
      <name>Sophie</name>
    </group>
    <group origin="Basque" sex="male">
      <name>Abal</name>
      <name>Abarrah</name>
      <name>Aberri</name>
      <name>Adiran</name>
      <name>Adur</name>
      <name>Agosti</name>
      <name>Aimar</name>
      <name>Aingeni</name>
      <name>Jaunti</name>
      <name>Javier</name>
      <name>Jeremi</name>
      <name>Jerolin</name>
      <name>Jokin</name>
      <name>Jon</name>
      <name>Joseba</name>
      <name>Josepe</name>
      <name>Josu</name>
      <name>Juaneizu</name>
      <name>Julen</name>
      <name>Jurdan</name>
    </group>
    <group origin="Basque" sex="female">
      <name>Abarrane</name>
      <name>Abelie</name>
      <name>Abeline</name>
      <name>Adere</name>
      <name>Adonine</name>
      <name>Aduna</name>
      <name>Gizane</name>
      <name>Goikiria</name>
      <name>Goizargi</name>
      <name>Gorane</name>
      <name>Gorka</name>
      <name>Gorostitza</name>
      <name>Soskao</name>
      <name>Soterraa</name>
      <name>Soterrana</name>
      <name>Terese</name>
      <name>Tipi</name>
      <name>Torres</name>
      <name>Trinity</name>
    </group>
    <group origin="Belorusian" sex="male"/>
    <group origin="Belorusian" sex="female"/>
    <group origin="Bengali" sex="male"/>
    <group origin="Bengali" sex="female"/>
    <group origin="Berber" sex="male"/>
    <group origin="Berber" sex="female"/>
    <group origin="Bermese" sex="male"/>
    <group origin="Bermese" sex="female"/>
    <group origin="Brazil" sex="male">
      <name>João</name>
      <name>Gabriel</name>
      <name>Guilherme</name>
      <name>Gustavo</name>
      <name>Lucas</name>
      <name>Luiz</name>
      <name>Matheus</name>
      <name>Pedro</name>
    </group>
    <group origin="Brazil" sex="female">
      <name>Ana</name>
      <name>Beatriz</name>
      <name>Giovanna</name>
      <name>Julia</name>
      <name>Larissa</name>
      <name>Leticia</name>
      <name>Maria</name>
      <name>Mariana</name>
      <name>Vitoria</name>
      <name>Yasmin</name>
    </group>
    <group origin="Breton" sex="male"/>
    <group origin="Breton" sex="female"/>
    <group origin="Bulgarian" sex="male"/>
    <group origin="Bulgarian" sex="female"/>
    <group origin="Canadian" sex="male">
      <name>Aaron</name>
      <name>Adam</name>
      <name>Alain</name>
      <name>Alex</name>
      <name>Antoine</name>
      <name>Benjamin</name>
      <name>Braydon</name>
      <name>Cameron</name>
      <name>Carter</name>
      <name>Cole</name>
      <name>Emile</name>
      <name>Ethan</name>
      <name>Felix</name>
      <name>Gabriel</name>
      <name>Hugo</name>
      <name>Jacob</name>
      <name>Joshua</name>
      <name>Logan</name>
      <name>Lucas</name>
      <name>Marc-Antoine</name>
      <name>Nathan</name>
      <name>Nicholas</name>
      <name>Owen</name>
      <name>Noah</name>
      <name>Philippe</name>
      <name>Raphael</name>
      <name>Ryan</name>
      <name>Samuel</name>
      <name>Tristan</name>
      <name>Tyler</name>
      <name>Xavier</name>
      <name>Zachary</name>
    </group>
    <group origin="Canadian" sex="female">
      <name>Abigail</name>
      <name>Alanna</name>
      <name>Alyssa</name>
      <name>Audrey</name>
      <name>Ava</name>
      <name>Camille</name>
      <name>Chloe</name>
      <name>Emily</name>
      <name>Emma</name>
      <name>Grace</name>
      <name>Hailey</name>
      <name>Hannah</name>
      <name>Isabella</name>
      <name>Jade</name>
      <name>Jessica</name>
      <name>Justine</name>
      <name>Kaitlyn</name>
      <name>Lea</name>
      <name>Madison</name>
      <name>Maya</name>
      <name>Olivia</name>
      <name>Rachel</name>
      <name>Rosalie</name>
      <name>Sophia</name>
      <name>Sydney</name>
    </group>
    <group origin="Cantonese" sex="male">
      <name>Chun-Yuen</name>
      <name>Minh-Wei</name>
      <name>Tak-Cheung</name>
      <name>Yukkin</name>
    </group>
    <group origin="Cantonese" sex="female">
      <name>Choi-Lai</name>
      <name>Faye-Kam</name>
      <name>Piu-Yan</name>
      <name>Yai-Jun</name>
      <name>Yee-Ting</name>
    </group>
    <group origin="Catalan" sex="male"/>
    <group origin="Catalan" sex="female"/>
    <group origin="Chinese" sex="male">
      <name>Li</name>
      <name>Lo</name>
      <name>Pong</name>
      <name>Ming</name>
      <name>Te</name>
      <name>Wei</name>
      <name>Zhuang</name>
      <lastname>Chen</lastname>
      <lastname>Cheung</lastname>
      <lastname>Kwong</lastname>
      <lastname>Choi</lastname>
      <lastname>Jiang</lastname>
      <lastname>Lee</lastname>
      <lastname>Meng</lastname>
      <lastname>Wang</lastname>
      <lastname>Wong</lastname>
      <lastname>Wu</lastname>
      <lastname>Yao</lastname>
      <lastname>Yeoh</lastname>
    </group>
    <group origin="Chinese" sex="female">
      <name>Xiuxiu</name>
      <name>Lili</name>
      <name>Xue</name>
      <name>Ying</name>
      <lastname>Chen</lastname>
      <lastname>Cheung</lastname>
      <lastname>Choi</lastname>
      <lastname>Huang</lastname>
      <lastname>Kwong</lastname>
      <lastname>Lei</lastname>
      <lastname>Wang</lastname>
      <lastname>Wong</lastname>
      <lastname>Yao</lastname>
      <lastname>Yeung</lastname>
    </group>
    <group origin="Croatian" sex="male"/>
    <group origin="Croatian" sex="female"/>
    <group origin="Czech" sex="male"/>
    <group origin="Czech" sex="female"/>
    <group origin="Danish" sex="male">
      <name>Alex</name>
      <name>Alexander</name>
      <name>Anders</name>
      <name>Frederik</name>
      <name>John</name>
      <name>Jørgen</name>
      <name>Mads</name>
      <name>Martin</name>
      <name>Michael</name>
      <name>Morten</name>
      <name>Ole</name>
      <name>Simon</name>
      <name>Tim</name>
      <name>Tom</name>
      <name>Viggo</name>
      <lastname>Andersen</lastname>
      <lastname>Hansen</lastname>
      <lastname>Jensen</lastname>
      <lastname>Pedersen</lastname>
    </group>
    <group origin="Danish" sex="female">
      <name>Agnetha</name>
      <name>Andrea</name>
      <name>Anika</name>
      <name>Karen</name>
      <name>Astrid</name>
      <name>Birgitta</name>
      <name>Frida</name>
      <name>Gudrun</name>
      <name>Katrine</name>
      <name>Kiersten</name>
      <name>Liselotte</name>
      <name>Magdalena</name>
      <name>Maiken</name>
      <name>Martina</name>
      <name>Merete</name>
      <name>Mia</name>
      <name>Ragna</name>
      <name>Rebekka</name>
      <name>Rita</name>
      <name>Ruth</name>
      <name>Sigrid</name>
      <name>Tina</name>
      <name>Vibeke</name>
      <lastname>Andersen</lastname>
      <lastname>Hansen</lastname>
      <lastname>Jensen</lastname>
      <lastname>Lund</lastname>
      <lastname>Nielsen</lastname>
      <lastname>Pedersen</lastname>
      <lastname>Petersen</lastname>
    </group>
    <group origin="Dutch" sex="male">
      <name>Arjan</name>
      <name>Boudewijn</name>
      <name>Casper</name>
      <name>Clarence</name>
      <name>Cornelis</name>
      <name>Diederik</name>
      <name>Edwin</name>
      <name>Jan</name>
      <name>Johan</name>
      <name>Karel</name>
      <name>Mario</name>
      <name>Peter</name>
      <name>Pieter</name>
      <name>Sander</name>
      <name>Stefaan</name>
      <name>Steven</name>
      <name>Wilfred</name>
      <lastname>Bakker</lastname>
      <lastname>Bergkamp</lastname>
      <lastname>De Jong</lastname>
      <lastname>Vandenberg</lastname>
    </group>
    <group origin="Dutch" sex="female">
      <name>Ann</name>
      <name>Aleida</name>
      <name>Ellen</name>
      <name>Eva</name>
      <name>Evelien</name>
      <name>Hadewych</name>
      <name>Jacintha</name>
      <name>Janneke</name>
      <name>Johanna</name>
      <name>Katrien</name>
      <name>Klasina</name>
      <name>Lisanne</name>
      <name>Marike</name>
      <name>Melanie</name>
      <name>Nicoline</name>
      <name>Sabien</name>
      <name>Saskia</name>
      <name>Tineke</name>
      <name>Xandra</name>
      <lastname>Bergkamp</lastname>
      <lastname>Smit</lastname>
      <lastname>Vandenberg</lastname>
    </group>
    <group origin="Egyptian" sex="male"/>
    <group origin="Egyptian" sex="female"/>
    <group origin="English" sex="male">
      <name>Aaron</name>
      <name>Adam</name>
      <name>Alex</name>
      <name>Alexander</name>
      <name>Andre</name>
      <name>Andrew</name>
      <name>Anthony</name>
      <name>Arthur</name>
      <name>Bill</name>
      <name>Barry</name>
      <name>Brian</name>
      <name>Bruce</name>
      <name>Charles</name>
      <name>Chris</name>
      <name>Clifton</name>
      <name>Colin</name>
      <name>Connor</name>
      <name>David</name>
      <name>Dean</name>
      <name>Duke</name>
      <name>Eric</name>
      <name>Eugene</name>
      <name>Evan</name>
      <name>Frank</name>
      <name>Gary</name>
      <name>Gene</name>
      <name>George</name>
      <name>Glen</name>
      <name>Graham</name>
      <name>Greg</name>
      <name>Harold</name>
      <name>Harry</name>
      <name>Harvey</name>
      <name>Henry</name>